{
  "status": "success",
  "summary": "Level actors listed successfully",
  "data": {
    "level_path": "/Game/Maps/TestMap",
    "actors": [
      {
        "actor_name": "truck_01",
        "actor_path": "/Game/Maps/TestMap.TestMap:PersistentLevel.truck_01",
        "class": "/Script/MyGame.BP_DecorTruck_C"
      },
      {
        "actor_name": "crate_cluster_a",
        "actor_path": "/Game/Maps/TestMap.TestMap:PersistentLevel.crate_cluster_a",
        "class": "/Script/MyGame.BP_CrateStack_C"
      }
    ]
  },
  "warnings": [],
  "errors": []
}
